rating,reviewText
Olumlu,ürün gayet güzel alal yıl olt hal bi problem yaşa kill suy çamur iç düşt çıkar bi üst göl duru telaş hiçbir problem olma hafız olarak der benç yeter ben gb al kadar hafıza zaten kullanacak bir belge vs olmuyor bil gb par verecek gb plus alsa keşk pişman olt tek pişmanlık
Olumlu,hızl gönder özen ambalaj apple tr garanti iyi raka teşekkür hb
Olumlu,alal yı olt ben tlf alma önç tlf değiştiriyor buçihaz aldık sonr ar değiş time bırak şükür herk tavsi ediyor hepsibura guvence hepsibura tsklr sağla güvenilir si şimt den hayır ols ols
Olumlu,hızl kargo teşekkür cumarte saat sipariş vert pazarte sabah elim cihaz güzel kargolan teşekkür
Olumlu,hızl uygun fiyat
Olumlu,ürün satıcı hepsibura olan al akşa üst verdik sipariş erte gün gelt kadar hızl gelecek beklemiyor apple e devlet üzer sorgulama yapt herhangi bir sor yok para değer git ip al kısm filan girmiyor zevk tercih pek sayg duyulmayan bir yer bura malum gü reng pek beğenme al güzel gelme başl gelen tepki olum
Olumsuz,sipariş verme üzer gün geme rağmen kargom halen yol görünüyor teslimat gecik
Olumlu,güzel hızl gelt süper bir tavsi eder
Olumlu,teşekkür
Olumlu,orijinal güzel bir telefon
Olumsuz,evet hızl şarj sade saat gidiyor hızl şarj ediyor şarj kötü
Olumlu,hepsibura com dan aldık bir yıl ara ikinç iphone biraz uç oluyor piyasa gör bilemiyor sonuç süper ilk telefon iphone plus it halen soruns aktif öyl çıkar umar bir teslimat ara beyefen yetiştiremiyor yok yı biraz geçebilir dedi aman yant bitt servis kaçar lütfen yetiş det pek delt yetiştir keşk getiren arkadaş bahşiş vers azın teslimat şirket bura teşekkür et olay
Olumlu,ürün zaten iyi paketlenme iyi hızl gönder akşa sipariş vert erte gün öğlen elim
Olumlu,ürün standart ı phone laki satıç arkadaş teşekkür eder cumarte al pazarte kapı hızl bir teslimat olt
Olumlu,ara kalt al erte gün gelt hızlıteslimatiç teşekkür telefon iyi ben beyaz al şık
Olumlu,hepsibura hiçbir yer olmayan fiya telefon bulmak harika hızl teslimat ayrı teşekkür
Olumlu,mükemmel bir ürün gör oldukç hızlan fark hiisedebiliyor i̇phone seri i atlamış sefer yi atla bun ar model çift seri büyük ilerle görülüyor fiyatı fark değil i fırsat verdik hepsibura teşekkür
Olumlu,ürün gayet güzel özellik sahip stabil çalışıyor fakat fiyat açık konuşmak gerekir insafsız ol bun site kaynsklanmadig biliyor uç diyen ülke hangi kısm yaşıyor merak ediyor
Olumlu,süper
Olumlu,cihaz iyi gerçek türl ihtiyaç karşılıyor kısmet hafta fites şahin takas edice zaman geçmiyor sabırsızlık bekliyor
Olumsuz,fiya kadar pek bişey beklememek gerekiyo kamerasi falan iyi fiyat gör
Olumlu,kesinlik alma gere bir telefon düş ancak alam para yetm
Olumsuz,tama piyasa iyi fakat yin bir şey eksik eksiklik tam karşılık yok mesela metn seçip kopyalayamamak büyük eksiklik telefon müzik indirememek
Olumlu,on numara ol sarj iyi fotoğraf on numara bun önç model nispe
Olumsuz,i̇lk üç ay sonr batarya ver yüz düşüyür
Olumlu,apple sefer tam istedik yap güzel cihaz
Olumlu,pro max sı bı haf kulanıyom cok cıhaz kullan on once note plus var arkadaş dur olan hıc dusundme alabılır ben boyle bır pıl omr gormedım hız kamera
Olumsuz,kamera olarak süper ols fiya paha
Olumlu,öncelik telefon bütün telefon camia ses getiren bir cihaz olmuş ben görüş gör çevre kim sor harika oldug vurguluyor ben dayana git apple magaza deney inanır mıs resmen aşık olt telefon kesinlik bun alma iç geçir kamera kadar iyi kalite fotoğraf çekiyor göz inanamıyor teknoloji kadar hızl gelişiyor sorguluyor samim söylüyor telefon ol el oturuş malzeme kalite üst sevi olma kamera iyi çekme kalitr hopör gerçek harika bir cihaz ol hepsibura fiyat avantaj teşekkür bir borç bilir
Olumsuz,arkadaş tavisye etme iyi değil
Olumlu,kamera siste güzel helek geç mot
Olumlu,ürün güzel bittibitiyor adl satıcı al aynı gün kargo gün ulaş orjinal ürün apple garanti henüz kullan ben aldık sonr indir olt üzg
Olumlu,öncelik gelecek biz satıcı teşekkür eder gün kargo soruns bir şek ulaştır tlfon orjinal sıfır açıl paket tlfon sim kart takıp kurul yaptık sonr ser numara tlfo garanti sorgulat garanti ik yıl ileri göster herhangi bir sor yok ürün apple türki garanti i̇nternetten tlfon almak isteyip ben terddüt kalan mutlak al piyasa gerçek alt bir fiya alıyor satıç puan yapılan yorum bak ben öyl al yüz satıcın adın vert teşekkür
Olumlu,ürün dün sipariş ett saatte elim ulaş fakat eşim dok gün hediye aldık kurul yapma sor olmaz inşallah
Olumlu,s den geçt plus pişman değil gerçek çözünürlük kamera şarj açıs gayet başarı sen ber ıos kullanıyor önç geçmedik pişman gerçek androit para rezil olacak kesinlik tercih etme plus kadar par vermey değmez benç plus gayet başarı yeter
Olumlu,ürün hızl soruns gelt
Olumlu,teşekkür hepsibura gelecek biz firma
Olumlu,ürün bugü elim ulaş ilk ıphone um zorlanmıyor ben üzecek bi cihaz olmadık bildik iç rahat satıç belirlenen tarih ürün gönder fakat paketle biraz özens gelt tabik ayr bir kutu iç koyulmıştu fakat kutu boşluk köpük desteklens iyi olabilir ürün hiçbir hasar yok eksik yok sıfır bir ürün gelt kendilik garanti süre başl bun iphone un resm site görebiliyor
Olumsuz,alma istedik bi model satıcı buradani kendi olduk ürün alacak uzun süre takip ediyor tedarikç bir firma güven yok zaman tedarikçi bura olur fiyat biraz iyileştir yapılır ürün zaman kaybetme alacak bildirmek ister
Olumlu,öncelik internet ilk kadar paha bir ürün al sor yaşar tereddüt fakat fiyat olarak piyasa lira aşağı olu dayana al gelecekbi̇zde isim satıcı kargo gaziantep e gün gelt ürün güzel kutulanmış hatt takı garanti başlıyor cihaz anlatma gerek yok önce kullandık telefon zaten severek kullanıyor ios işle sistem stabillik sadelik hız bağım oluyor tamamen kalite bir ürün cihaz kullandık sonr android cihaz yer küçük takılma yüklenme bil can sıkıyor başka cihaz kullanamıyor
Olumlu,ürün al kargolama sor yok ürün güzel garanti fatura birlik gelt internet garanti ona yıl garanti alacak arkadaş gönül rahatlık al
Olumsuz,evet hızl şarj sade saat gidiyor hızl şarj ediyor şarj kötü
Olumlu,hepsibura com dan aldık bir yıl ara ikinç iphone biraz uç oluyor piyasa gör bilemiyor sonuç süper ilk telefon iphone plus it halen soruns aktif öyl çıkar umar bir teslimat ara beyefen yetiştiremiyor yok yı biraz geçebilir dedi aman yant bitt servis kaçar lütfen yetiş det pek delt yetiştir keşk getiren arkadaş bahşiş vers azın teslimat şirket bura teşekkür et olay
Olumlu,ürün zaten iyi paketlenme iyi hızl gönder akşa sipariş vert erte gün öğlen elim
Olumlu,ürün standart ı phone laki satıç arkadaş teşekkür eder cumarte al pazarte kapı hızl bir teslimat olt
Olumlu,ara kalt al erte gün gelt hızlıteslimatiç teşekkür telefon iyi ben beyaz al şık
Olumlu,hepsibura hiçbir yer olmayan fiya telefon bulmak harika hızl teslimat ayrı teşekkür
Olumlu,mükemmel bir ürün gör oldukç hızlan fark hiisedebiliyor i̇phone seri i atlamış sefer yi atla bun ar model çift seri büyük ilerle görülüyor fiyatı fark değil i fırsat verdik hepsibura teşekkür
Olumlu,ürün gayet güzel özellik sahip stabil çalışıyor fakat fiyat açık konuşmak gerekir insafsız ol bun site kaynsklanmadig biliyor uç diyen ülke hangi kısm yaşıyor merak ediyor
Olumlu,çarşamp gün sipariş vert perşemp gelt kutu iç herşey var korkarak al gayet memnu
Olumlu,i̇phonedan şaşm al sev
Olumlu,telefon eylül al yaklaşık yıl apple kullanıcı i̇phone konu kapsam bir sun tecrübe var şun net bir şekil belirtmek isterimk apple kamera stabilizasyon dayanıklılık konu rakips bir firma telefon çıka yıl olmuş ben aldık tereddüt etme tecrübe dola direk gidip sat al bugü özellik stabil çalışıyor tek can sıkan kon geç şarj olma on w bir adaptör alarak çözt paha evet paha gerçek ödedik ücret karşılık bir telefon bekledik şey gerçekleştiriyor maddi sebep x xs xs max vb alamıyor diyor halen güven i̇phone plus alabilir yedekle işin iyi değil lütfen min gb al kal sağlıcak umar tavsiye kullanıcı fayda olur
Olumlu,lafi fazl uzatmiyor fi̇yata androi̇d ci̇hazlar var di̇yi̇p alip sonr i̇osu muml arayan olmayi apple nasil ci̇haz çikarirsa çikarsi satiyor servi̇s müşteri̇ memnuni̇yeti̇ uygula opti̇mi̇zasyonu malzeme kali̇tesi̇ olarak püyasani tek li̇deri̇ fi̇yata başka ci̇haz bakip macera gerek yok
Olumlu,soruns
Olumsuz,para hafız mükemmel
Olumlu,süper bayıl tavsiye eder bir sor olma telefon kulaklık bir önem güvenilir
Olumlu,güzel alışveriş olt plus cihaz hepsibura iş uzman gönder teslimat sıkıntıs alışveriş olt gönül rahatlık alabilir
Olumlu,süper ürün paketle gayet iyi tskler
Olumlu,ürün aldık gün kargolan ptt kargo elim ik gün ulaştır telefon memnu an kadar hiçbir sık yok kut özen hazırlanmış teşekkür hepsibura
Olumlu,kutu iç dönüştürüç çıkm ilan sahip ben iletiş geçme istiyor bun dış bir sor yok
Olumlu,paketle gayet iyi sağla gelt memnu kalt
Olumsuz,kargo yavaş haf sonr geliyor kargo düzeltilme ister yine şey iyi kargo hariç sinir bozuç olabiliyor
Olumlu,ürün gayet güzel bildik iphone iş gün elim ulaş hepsibura yanılt ben herzmanki
Olumlu,kullandık plus pert olduk nci ye al ilk aldık iç kulaklık dönüştürücü çıkmış bun çıkm suan sor yok
Olumlu,fiyat halen yuksek gb cunk bin e duser almayi dusunur plus super telefon
Olumlu,kağıt üzer özellik üst android yazılım bir telefon geçt iphone dan aman sak ios işle sistem şaşmay yavaş geliyor android ios sonr apple sade isim ibaret değil gerçek
Olumlu,telefon gün kullanıyor hiçbir sor karşılaş kargo söylenen süre gelt telefon internet alıyor tereddüt var yers olduk orta çıkt satıcı teşekkür eder
Olumlu,ürün i̇phone zaten kargo berbat hafta yurtdış gidecek ürün kent sınır iç ancak el ulaşıyor i̇nternet alışveriş bir cazibe kalmıyor sor bütün kargo gün ulaşır
Olumlu,bildik iphone plus plus ban gör hiçbir fark yok
Olumlu,telefon sat aldık sonr kur artış görü iyi al det yıl android kullanan olarak iş gerek i̇phone kullanım alışma gerek alıştık sonr pratik kullanış olduk gört teşekkür
Olumlu,iphone un güzel seri plus silver renk ayr bir hav ver telefon memnu kalt fiyat piya lira uygun al teşekkür hepsibura
Olumsuz,kargo ptt olma kötü kulaklık arıza çıkt
Olumlu,ürün hepsibura satıcı al paketle güzel yapılmış ürün aldık hemen dene fırsat olt çalışmayan eksik çalışan bir böl bulunmuyor ayrı telefo imt numara apple site baktık orijinal ik yıl garanti olduk görülüyor şüph eden gönül rahatlık alabilir teşekkür hepsibura
Olumlu,hepsibura satıç olarak gayet başarı ürün güzel tavsi eder
Olumlu,şimdilik bir sık yok numara haf sorums garanti orjinal ürün tek dilek satıç kesinlik hepsi̇burada ols geri sık yok
Olumlu,bekledik tarih önç ptt şube gelmiş fazl beklememek gidip tesl al güzel paketlenmiş bir haf kullanıyor şimdilik sor yok görünüyor tavsi eder
Olumlu,ben yorum bakarak al gerçek güzel dışarı gör uygun tavsi ediyor
Olumlu,gayet güzel tavsi eder
Olumlu,satıç hepsibura it söylenen saatte tesl edil
Olumlu,hepsıbura hızmet anlayı muhte urun saat al ertesı gun hepsıexpress kargo ıle saat elımdeydı hersey ıç tesklerr hepsıbura
Olumlu,hepsibura satıcı iphone plus al kulaklık dönüştürüç yokt başka bi sık olma dönüştürüç olmama garip git
Olumlu,ürün türki garanti paketleme güzel tereddüt sat al yük tutar ürün olduk kutu falan mağaza alır üzer jelatin ben açt güvenilir tereddüts alabilir orjinal apple
Olumlu,jelatin orijinal paket geliyor korunak paketlen
Olumlu,hepsijet erte gün gelt soruns güvenilir teşekkür hepsibura
Olumlu,i̇phone plus golf sipariş vert hepsiexpress kargo topla saatte elim ulaş jelatın güzel telefon memnu tavsi eder hepsibura teşekkür
Olumlu,telefon gayet iyi gelt kargo geç geliyor ayrı dönüştürüç çıkm
Olumlu,ürün hepsijet fazla hızl gelt geç sipariş verdik ürün sabah elim hızl kargo kalite ürün
Olumlu,hızl özen kargo memnuniyet teşekkür
Olumlu,geçen haf sat al kargo gecikme gelt bun dış sor yok ürün orjinal mükemmel gönül rahatlık alabilir teşekkür
Olumlu,piyasa uygun orjinali orjinal iphone olduk bell kargo olarak pıt pı sarıl asl kırılmaz zaten teşekkürlerrr
Olumlu,gönder hızl ürün kusurs koruma gönderil teşekkür
Olumlu,soruns bir şekil taraf ulaş
Olumlu,teşekkür orjinal ürün ithalat kayıt ambalaj kargo kusurs hayır kazanç diler
Olumlu,hızl gönder soruns elim ulaş teşekkurler
Olumlu,hızl gönder teşekkür kulaklık jak adaptör içeri yokt on anlaya satıç irtiba geçme rica ediyor
Olumsuz,telefon güzel hızl batarya kamera bakım iyi değil şekil görünüş açıs güzel teşekkür
Olumlu,ürün akşa saat hızl sipariş seçenek sipariş ett saat aralık olarak işaret erte gün saat sipariş kap paketle özen olarak yapıl ürün içeri eksik malzeme yokt satıcı bura olarak sat al güvenilir olduk bir kaç arkadaş söyl gerçek güvenilir siz önerir i̇mkanınız var satıç kısm bura bir yazan ürün al
Olumlu,kargo biraz gecik ürün orjinal iyi paketlen
Olumlu,çabuk gelt sor yok
Olumlu,iphone lar pek nesil farki olmuyor andeoid cihaz oluyor nesil farki cunk iphone lar zaman onde gidiyor cihazi kamerasi son cikan tum android cihaz cok iyi stabilite halen yakalayabilmis bir android cihaz gorme mutlak bir sekil ram temizlig yapar diyeceg tek sey iphone plus türl alinir rahat ol
Olumlu,hızl soruns gönder teşekkür
Olumlu,android telefon kullanıyor i̇yiki al pişman değil muhteşe
Olumsuz,yaklasik bir bucuk yıl kullaniyor kamera emsal gör bayak kötü şarj artik gün boy yetmiyor bun hariç sor çıkarmayan akıç bir telefon
Olumsuz,telefon kaç nesil önce telefon fiyat olma gereks
Olumsuz,begen inşallah uzun sure begenir sor olmaz
Olumlu,soruns gelt kargo verilme biraz uzun sürt gün kadar orjinal cihaz gönül rahatlık alabilir
Olumlu,güzel iphone kalite _
Olumlu,iyi
Olumlu,ürün satıcı memnu mode alırken arıştırt siyah reng bo atma sorun karşılaşan insan olduk oku aynı dur ben baş gelt ürün aldık gün erte gün kılıf al kılıf çıkarmadık halde hoparlör kısm oras buçuk ay sonr boya attık gört apple bun birçok kişi karşılaştık bir dur olma rağmen kabul etmiyor kullanıç hata diyor yüz alma önç bun göz önün bulundur
Olumlu,androit geçiş yapt keşk önce alsa det tek eksi şarj başka bi eks yan yok
Olumlu,cok güzel ürün herkez alabi̇li̇r
Olumlu,yaklaşık ay önç al memnu keşk önce tereddüt etme alsa araştır son doğr tercih bul
Olumlu,kargo ürün bir sık olma fakat alacak arkadaş iphone plus mat model cihaz arka kılıf lek bırakıyor özellik slikon kılıf leke geçmiyor ben lansman kılıf kullandık halde lek kalt garanti bir şekil kabul etmiyor ben tit biri dur oldukç can sıkıç
Olumlu,yaklaşık bir yıl önç al aynı göründük güzel bir telefon herk tavsi eder
Olumlu,telefon alal buçuk ay olt şarj gidiyor kullan kaynak çalıştık zaman rahat ik gün gidiyor tasarım beğen ilk iphone um bi saat iç çözt yen yen özellik öğren ik ay içeri almak ister şun önerir pahalılaş ben aldık fiyat üst tl art tercih ettik satıç bittibitiyor ev tesl edil kargo git al problem olt üst model tercih edebilir fakat aynı özellik değişiyor on iç par çarçur etme değmez bir şahi para verme alem yok jsjsj d
Olumlu,ay önç al sipariş verdik gün sonr elim ulaş soruns bi şekil kullanıyor
Olumlu,tek sıkıntı sarj hızl bitiyor app nın tek eksig başka eksig yok ikinç plus ilk aldıg yıl kulanıp madi konu yuzunden satmış sonr düze tekrar al yapa androıdde şimt raha bun sonr inş x alır
Olumlu,başarı satıç
Olumlu,telefon yıl önç satmış uapa tekrar al androıd kulanılmıyor yavas hız alış yapamıyo androıdle
Olumlu,gün iç elim ulaş kargola iyi hiçbir şekil zedelenmeyecek biç paket i̇nşallah kullanırken sık çıkmaz
Olumlu,hızl gönder lightning mm kulaklık jak adaptör i̇çerisinde yok
Olumlu,ürün fiyat olarak alabilecek düşük şuan bütün internet satış yapan firma araştır ürün kontrol edem fakat ptt kargo rezillik had safha kargo hariç bir sık çıkacak düşünmüyor
Olumlu,başarı bir ürün fiyat düş yen model çıkı
Olumlu,telefon alma önç tereddüt kalmış elim ulaştık öncelik garanti sorgulat site yazıldık çıkt telefon memnu alma düşünen var tereddüts alabilir teşekkür hepsibura ekip
Olumlu,pazar sabahi sipariş vert ayni gün tesl seçenek aksa tesl edil hepsiburada tebrik eder tr yıl aplle garanti
Olumlu,bir gün ürün elim ulaş paketle iyi hepsiexpres e teşekkür harika
Olumlu,ürün kulaklık çeviriç çıkmıyor ar bilg ols fiya süper ürün tr garanti teşekkür sar elektronik
Olumlu,yaklaşık sen ön aldık telefon cidt anla memnu kalt hal şarj dol bütün gün yetiyor tavsi eder
Olumlu,ürün belirtildik apple türki garanti alt gönul rahatlık alabilir
Olumsuz,apple in sattig uç plus model cihazi tasarim haric hic esk hiss vermez kamera iyi ekran iyi su dayaniklilik var hal cog android telefon hizl batarya cok iyi degil idare eder kullanmiyorsaniz saat gunde benç hal alinabilir siz yil goturur soruns
Olumlu,teşekkür hızl kargo özen paketle ol
Olumlu,telefon kıs süre gelt kontrol yaptık sonr yazmak iste gayet iyi satıç soruns ulaş yaln kut içeri yerleştir ancak kut iç boşluk köpük ya kaparcık koruma poşet kullans iyi olabilir kargo şirket pek özen davranmıyor kaldırıp atıyor şube şube gider ben sıkıntıs al teşekkür eder
Olumlu,firma ürün güzel paket saat olma tesl al cihaz söylenecek bir yok yıl cihaz dene son yin iphone karar kılt plus benç plus avantaj eksik yön yok akl sor işare var düşünme al der
Olumlu,on numara hızl bir cihaz haziran sabah sipariş vert haziran elim ürün ulaş teşekkür eder kargola paketle iyi maalesef kutu iç jak adaptör çıkmıyor on üzül apple yen üretilen cihaz adaptör kaldır aldık cihaz nisan üretil esk telefon iphone it plus geçt memnu tavsiye plus al
Olumlu,çocuk al beğenerek kullanıyor
Olumlu,iphone aldık para hakk veriyortereddüts alabilir herk tavsi eder
Olumlu,kargo telefon on numara
Olumlu,ürün bittibityor al geç gelt telefon bun değer memnu
Olumlu,cihaz sipariş teslima süreç hızl sorunsuz cihaz herk malum yıllık bir cihaz olma rağmen donan olarak gayet yeter tabik benzer fiyat güncel cihaz bulunabilir tercih ios alınabilecek iyi fiyat performans ürün kontrol ettik cihaz yıl garanti apple türki olduk teyit ett ayrı üret mart olduk teşekkür bittibitiyor
Olumlu,ürün yen herşe iş tam sagla gelt teşekkür eder
Olumlu,ürün bittibitiyor satıcı al ürün yor yapmıyor biliyor mükemmel kargo hızl gelt fakat paketle pek iyi değil kutu küçük ezil var sık değil teşekkür
Olumlu,ürün cok guzel cok hizl fakat kargola cok kötü kut iç koyup gondermis paketle iyi degil sürat kargo kargo bulamadi yak zaman kisacasi kargola haric iyi
Olumlu,hızl kargo sagal ürün
Olumlu,kargo firma biraz üzs genel olarak problem yaşa gelir gelmez ime numara garanti sorg apple türki garanti mevcut alacak akl sor işare kalm hepsibura bittibitiyor com a teşekkür
Olumlu,plus cihaım değişmek istedik plus ara seç yapma gerek fazl fir farklılık olmadık fazl ödeme plus almak karar vert plus ödeyecek miktar dha arttırır x tercih eder ürün kapa kutu olarak tesl al kurul geçmek sabırsızlanıyor
Olumlu,yaklaşık sene plus kullanıyor şarj iyi gidiyor pubg falan girdik çabuk bitebiliyor on dış telefon gayet iyi fiyat hakediyor
Olumlu,soruns alışveriş teşekkür eder
Olumlu,araştırdık sonr üzer yer plus karar kılt iyi etmiş telefon süper film video oyun vs indirmedik hafıza ben fazla yeter i̇nternetten i̇phone karşılaştır video izler zaten performans ara fark yok şarj ban ik gün dayanıyor ik saati biraz üzer şarj oluyor bittibitiyor dan al hızl rahat güven bir alışveriş olt
Olumlu,ürün gayet güzel bir şekil kap kadar gelt paketle iyi değil fakat ürün olmamış bakm umar apple türki garanti
Olumlu,hepsibura teşekkür satış konu yardımç oldu telefon anlatma gerek yok benç sade şarj biraz uzun sür git iyi olmaz mıyt düşünüyor insan son derece güzel bir ürün tavsi ediyor ilgi
Olumlu,ürün alal haf olt ısın sarj hariç yönü harikulade bir telefon uygulamar ara geçiş performans özellik iyi pubg hdr oynuyo sıfır kasm ios kullandık sonr android kullanmama karar vert düşünme al
Olumlu,guzel alisveris tsk
Olumsuz,ürün mart al iyi paketlen gönderilmiş kargo süre iyi bir sene fazl süre kullanıyor i̇lk i̇phone telefon beklenti alt performans gösteriyor maalesef kamera geç mot kötü hafıza kıs süre dolma rahats ediç kent dosya bir yer altarma çalışırken yaşadık ızdırap fena siz tavsiye satıç iş yapabilir güvenilir işbirlik iyi i̇phone alacak tavsi etme
Olumlu,ürün açıklama firma yar kargo deme rağmen geç gönderiyor
Olumlu,telefon ik gunde elim yil apple turki garanti cok tesekkurler
Olumlu,bittibitiyor dan al memnu kalt hasars bir şekil gelt an severek kullanıyor önce ıphone kullanıyor tavsiye iphone plus özellik bayan erkek büyük gelebilir
Olumlu,apple kullanan bilir alış android kullanamaz stabil yazıl kali bir ara
Olumlu,wifi problem yüz yeni değiştirl apple servis taraf on hariç memnu
Olumsuz,cihaz al fakat fatura yolla haf olt alal biraz kullan yor yapıca
Olumsuz,telefon alma önç düş s s plus iphone ara ba kalt plus alma karar vert bun önç iphone kullanıyor s s alma sebep ios işle siste vall iphone ara pek fark yok kamera güç boyut anlam telefon güzel ancak yen bir telefon mutlulug vermiyor
Olumlu,ürün yazılan kıs süre gün iç elim ulaş piya fiyat alt tel sahip olt gelecekbiz hepsibura firma kalite hız dola teşekkür rahatlık alışveriş yapabilir iyi çalış
Olumlu,telefon bur alan arkadaş gelen cihaz hangi ios sür geliyor açıklama görünüyor bazen son sür güncel olarak gelebiliyor güncel versiyon sor oluyor bilgi mevcut
Olumlu,ürün tavsi ediyor gerçek efsane kargo hızl
Olumsuz,ekran küçük çizik var ger gönderecek yapacak hakk hiçbir bilg yok
Olumlu,süper performans kali
Olumlu,ekspress hızl soruns gelt ürün belirtildik özelik fiyat performans ürün teşekkür edebilir
Olumlu,diyebilir kalite orta
Olumlu,ürün bittibitiyor satıcı al paketle güzel kargo şirk yavaş yurtiçikargo olma iyi olur ürün soruns şekil gelt tavsi eder
Olumlu,kalite orjinal ürün
Olumlu,huawei xiomi der aylık telefon ara serüven son apple a karar vert android kullanmak istemiyor ar kasma donma sıkıl select ünvanli satıcı diğer ad şengül iletiş dün öğle sonr bura com üzer siperiş vert teslima gün sonr görünme rağmen gün bugü öğlen elim ulaşma ben mutl ett bura aile select isim satıcı teşekkür ediyor başarı devam diliyor
Olumsuz,al ses sor yaşıyor kulaklık takma ses karş taraf gitmiyor mikrafon sor var garantıye verebilir
Olumlu,bitt bitiyor al özen paketlen soruns al zaten telefo kalite diyecek yok
Olumlu,i̇os işle siste zaman iyi eksik yön kişiselleştiremiyor ver transfer aynı cihaz olmadık taktir aktar saglamıyor kamera iyi grenlen oluyor kamera arayüz pro özellik yok müzik aktarmak bilgisayar baglama gerekiyor itunes e sürek güncelle geliyor yüklemek istedik ha veriyor tekrarlamak gerekiyor o zaman çalıyor istedik kullan sağlamıyor ben android stok kamera bil kullanabiliyor i̇os ta atıyor fotograf düzenleyiç yüklemek bil para aşır paha kısaca i̇os androit akıç ara mesafe kalk eski degil iphone aşır paha araba fiyat iphone alıyor diyecek bun
Olumlu,telefon kırıl kargo verir hemen lütfennnnn
Olumlu,select adl satıcı al kapa kut adana gün gelt
Olumlu,sipariş verdik bir gün sonr elim ulaş kapa kut apple türki garanti boş mağaza alıp lira fazl verme gerek yok fiyat iyi telefon zaten anlatma gerek yok
Olumsuz,gelecek biz firmasindan nisan sipariş vert ayni gun kargo verilme gerekir nisan kargo veril nisan elim telefon ban pek ilgi gelm şahsen firma telefon sık yok memnu
Olumlu,merhap telefon yaklaşık bir haf kullanıyor yılan akıyor telefon anlatma gerek yok inceleme performans zaten biliniyor yıl bil güncel hızl kamera olay iyi çekiyor ağır oyun kasma oynatıyor pubg asphalt diğer gb yeter hızl şarj olmama kötü gold reng al memnu
Olumlu,yanlışlık üç yıldız ver gelecek biz ekip yıldızlık
Olumlu,paketle teslimat hız süper teşekkür tereddüts alabilir
Olumlu,bittibitiyor dan al kargo gün teslim gün önç gelt telefon kutu hafif ezil var problem değil ben telefon kusurs çalışıyor almak isteyecek tereddüt etme al fiyat normal mağaza oran iyi
Olumsuz,ürün soruns elim ulaş sade köpük kutu konul iyi olur kargo şirket malum sipariş taşırken pek dikkat etmiyor telefo garanti sorgulatma becere sanır gelecek biz firma ara nezaket yardımç olt bir beyefen sağol tekrar sık yaşar arayabilecek söyl tabi bil güven vert döne alabilecek uygun fiya aldim telefon elim hızl ulaş plus zaten bilen bilir anlatma gerek yok yen mode çık ols plus can
Olumlu,müthiş telefon yıl geçiş inanılmaz ara sıkıntıs bir şekil geliyor
Olumlu,haf kullanıyor bittibitiyor satıcı al soruns hızl bir şekil gelt paketle biraz özen yapılabilir on dış gönül rahatlık alabilir
Olumlu,kafaniz rahat ali
