rating,reviewText
Olumlu,yaklaşık ay kullanıyor memnu ben yurtdış aldık fiyat konu bir demeyecek ancak telefon tam bir canavar batarya ömr muhteşe yüz tan teknoloji diyecek hiçbir yok zaten zifir karanlık bil efsan çalışıyor
Olumsuz,abart fiyat alınmaz fiya
Olumsuz,aşır paha f p özellik kaybeder
Olumsuz,arkadaş fiya paha değil de paha değil ithalatç garanti olacak fiyat disbiritör garanti huawei p pro fiyat samsung s fiyat ne gör paha değil
Olumsuz,bir tane alan bir tane bedav olmadık süre alınmaz i̇thalatçı garanti bir ürün par verilmez
Olumsuz,telefon iphone x gbnin yar fiyat gb diğer telefon olmayan iphone x olan yüz tara teknoloji sahip
Olumsuz,telefon fazl radyasyon yayıyor sağlık düşünen başka telefon al
Olumsuz,telefon aylar beklıyor hayal kırıklıg ugra fıyat ozellıklerı acıs
Olumsuz,fiyat konu malesef üzt do hali ülke fiyat olacak malesef telefon alırken bir telefon devle alınıyor hali fiyat satılıyor yapacak bir yok sat alma dolar düşme bekley
Olumsuz,bekledik bir telefon ancak fiyat beklent uzer piyasa girt açıkça hayal kırıklık uğra yin apple kullanma devam edecek kısaca olums
Olumlu,arkadaş yaziyo pahali falan donan anliyomus yaziyo yen çıkan çok amiral gemi kaf tutuyor
Olumsuz,fiya iyi telefon alınabilir
Olumlu,paha diyen kur haber yok heralde do ol para değer düşüyor yoks telefon paha degil
Olumsuz,ar abart fiya telefon alınır su dayanıklılık yok araştır bak aynı fiya hat düşük fiyat diğer marka telefon su dayanıklılık var para telefon verecek sonr bir damla su telefon bozulacak sonr servis bütün kapı yüz kapatacak yok öyl
Olumsuz,tanıtıldık gün ber bekliyor son dayanamayıp başka bir telefon al pişman olacak düşünmüş fiyat sonr pişman değil
Olumsuz,telefon fiyat benç
Olumsuz,fiyat xiaomiue tasarima cok fazl
Olumsuz,boyle fiyat olmaz huawei p pro alir millet saticilari insaf devet ediyor do yuksek verg cok diyen arkadaslari biraz arastirma yapma davet ediyor
Olumsuz,f p ozellig kaybetmis bir xiaomi
Olumsuz,fiyat hızl azalicaktir merak etmey
Olumsuz,diğer marka amiral gemi gör düşük özellik f p düşük
Olumsuz,fiyat paha düşünüyor
Olumsuz,fiya paha böyl fiya türki piya yapamaz fiyat amiral gemi alınır
Olumlu,arkadaş yok yer telefo puan yer çekme anla yok paha dedik telefon iphone x den i̇yi̇ bir telefon iphone x in yar fiyat cihaz kesinlik f p ürün eleştirip yargılarken biraz mantık tarafs düşünme çalış bütçe yetmiyor telefon gömme gerek yok ürün kesinlik yıldız
Olumsuz,fiya telefon olmaz
Olumlu,arkadaş amiral gemi bir telefon gör fiyat normal özellik diğer amiral gemi gör gayet iyi
Olumsuz,fiyat yük
Olumsuz,fiyat saçm bir zaman fiyat performans ürün ar apple samsung fiyat performans oldu vay be
Olumsuz,fiyat dusme biraz bekleyel
Olumsuz,fiyat gercek aşir yuksek bask yer biraz dusuk fiyat bulunabilir çikmasin dort gozle bekl alacaktik fakat fiya ustune koyup note ya s almayi dusunuyor artik fiyat ba dusme tutunabil
Olumsuz,gerçek fiyat paha hepsiburada bekleyen bir sür insan var tam bir fiyasko olt fiya alınmaz
Olumsuz,aylar telefo gelme boş bekl beklemes fiyat do artış önce birçok cihaz alabiliryor
Olumsuz,kadar paha olma beklemiyor
Olumlu,fiyat paha den fark do tl olt telefo performans ıphone x karşılaştırılıyor ıphone x in fiyat yarı kalıyor ayrı hatırla telefon gb azıcık man
Olumsuz,para asl alınmaz almay
Olumsuz,xaoimiye yakış cok ayıp etti
Olumsuz,söz fiyat performans ürün olacak i̇thalatçı garanti bir cihaz kadar ücret ödenmez değecek bir fiya düşer alınabilir yoks samsung apple huawei sat alınabilir benç
Olumsuz,zaten xiaomi dusuk fiyat ic n aliniyor anla gider iphone huawei alır fiya alinmaz
Olumsuz,fiyat gerçek ol
Olumsuz,fiya tlf par samsung dan xaiomi geç sanır tekrar samsung geçecek bye bye xaiomi
Olumsuz,biraz verir iphone alir
Olumsuz,kablos şarz yok stero hopörlör yok kızıl ötes kaldırıl fm radyo yok su geçirmezlik yok kamera geç performans düşük mm kulaklık giriş yok fiyat fazl
Olumsuz,fiyat performans ürün de bekl fiyat ithalatç garanti pek tercih edilecek sanmıyor
Olumsuz,bulunmaz hint kumaş başka telefon yok fiya bedav
Olumlu,kur fark arkadaş telefo fiyat yurtdış gayet uygun marka yer yer vurma gerek yok
Olumsuz,fiya tati gider iyi
Olumsuz,p pro alır işin bakar
Olumlu,fiyat yük bulan arkadaş ne gör yük bilel iphone x ten iyi bir tel fiyat uygun s alır diyen tel s dan iyi uç yin fiyat performans xiaomi
Olumsuz,paha uygun olma bek
Olumsuz,paha bekledik fiyat giriş yapma
Olumlu,performans konu üzmiycek olan çen kısmı diğer androit fark olarak boş deil infrared sensör mevcut ülke do kur verg yüz fırl olan akıl telefon fiyat xiaomiyede etk et ols gerek
Olumsuz,olma gere fiyat üst
Olumsuz,i̇thalatçı garanti olarak alan bir insan fiyat performans odak düşünüp tercih ediyor do kur vs yük olabilir ancak fiyat bant çıkan herkes teknik destek konu sık yaşamayacak samsung huawei apple marka yönelecek xiaomi kullanıcı olarak konuşuyor gerçek telefon donan konu diyecek bişey yok
Olumlu,değil sene kadar samsung marka bişey kalmayacak orta xiaomi appledan sonr piyasa tek hakim olacak işlemci malzeme kalite bir hayli üst zaten snapdragon işlemci samsung diğer marka xiaomi veriyor pahal elbet değil asıl paha olan değil samsung göz kapa düşünme al
Olumsuz,fiya telefon alinmaz s qlinir tr garanti
Olumsuz,paha
Olumsuz,xiaominin fiyat performans özellik kalm samsung fiyat aynı ol neden samsung devam arkadaş
Olumsuz,fiya biraz katıp iphone al
Olumsuz,vall ben düşünüyor fiya alına değil zaten cihaz cazip kılan tek unsur fiyat performans olma yazık
Olumsuz,sene iphone s kullanıyor hali apple yavaşlat ar eski civar kılıf bil bulamıyor sen sınav sene olduk telefon işin erte sınav bitt yin iphone alma düşünüyorken youtube ürün tanıt video çıkt karş izle ilg çekt diğer video izli der nere ürün alaka video izle bütün video fiyat aralık olacak söyleniyor performansı iphone x yarışacak bahsediliyor hali ilg çekt aylar türkiye gelme bekl gün araştır fakat karş böyl bi fiyat görü şaşır teknoloji anlayan vatandaş fiyat düşecek söylüyor fakat kadar bekleyecek iphone zam gelt yapacak bilemiyor iş kafa karışık biraz
Olumsuz,fiyat hızl düşme hızl hızl
Olumsuz,xiaomi f p fiyat performans açıs iyi olduk sat alınan bir marka fiyat samsung apple yaptık sonr kims gidip bun almaz bun alacak samsung s alır azın türki garanti bir telefon olur
Olumsuz,kadar do yük ols f p olan cihaz fiyat yük
Olumsuz,sen mi sin fiyat ne yahu paha aşır derece paha
Olumsuz,fiyat yük xiaomi fiyat performas cihaz olamak çıkt alınmaz
Olumsuz,telefon kadar par verilmez
Olumsuz,fiyat yük alinmaz bi fiya
Olumsuz,fiya p alır paha
Olumsuz,hb yap güzellik yetise
Olumsuz,paha
Olumsuz,fiya so alınır
Olumsuz,ürün diyecek bişey yok fi̇yat pahali
Olumlu,telefon fiyat paha dedik marka dünya telefon piyasa sene el geçirecek firma bilg ols
Olumsuz,beklenen fiyat fazl kadar para telefon haketmiyor
Olumsuz,tam bir hayal kırıklık kamera vasat fiyat eder fazl buni alacak biraz katıp s alınır
Olumsuz,yük performans aşır yük fiyat
Olumsuz,fiya tr garanti bir cihaz alınır
Olumsuz,xiaomi uç fiya iyi teknoloji sunabildik tercih ediliyor böyl olur xiaomi sıra bir marka olacak
Olumsuz,paha fiya kesinlik alınmaz başka telefon yönelmek mantık
Olumsuz,paha
Olumsuz,fiyat uçuk ol iphone esk mode alır iyi
Olumlu,şimt bazı paha diyor bun alca s felan alır diyo telefon onlar hemen hemen aynı özellik sahip ben telefon al özellik gayet güzel şimt bin lira verip iphone x mi alınma yoks biraz marka takıntı kırıp telefonm alınma
Olumsuz,çooooook paha
Olumsuz,ürün özellik kalite değil satıldık raka dola eleştiriyor
Olumlu,harika beğen tavsi eder
Olumlu,kamera hız full ekran herşey numara telefon hiçbir oyun kasmıyor büyük full çentiks ekran youtube netflix film izlemek keyif pil birgün rahatç tamamlıyor sade kablos şarj desteklememe mono hoparlör olma dış kusurs ayrı küçük çocuk var telefon çocuk kullanma iz veriyor tavsi etme sonuç kamera motor çalışan bir mekanizma sahip çocuk ilgi çekiyor küçük çocuk isteme kamera zarar verebilir
Olumlu,ürün hızl bir sekil elim ulasti a e karar verme önç telefon magaza incele firsatim ols el verdig kali hiss sons ekran keyf iyi hissettiriyor uzun süre zaten samsung kullanici android siste üst tanimam on dış ben gold reng tercih ett rahatdiz etmeyen tatli bir pemp rode gold detaylari cok sevt ekran olduk büyük zaten özelik tercih buyuk ekren seven keyif alacaktir kamera cekim selfi cekim zaten dönen kamera saye gayet canli parlak tatmi ediç ses sorun bahsedilmis on değinmek ister evet ön hoparlör olmamasi ses an ekran yayiliyor olmasi hafif bir yank sor yaratiyor nokta ses konu ince detay takılmıyor zaman alisilir
Olumsuz,telefo özellik yuz tanima var yazıyor yuz tanima yok tam husran
Olumsuz,keşk fiyat biraz uç olsa
Olumlu,keyif bir telefon sel fi çekim mükemmel güçl çook kalite
Olumlu,memnu kalt satıcı hem telefon özellik olan keyif kullanacak bir telefon
Olumlu,cihaz güzel iphondann iyi tavsi eder kamera fln super
Olumlu,telfon al şuan kullanıyor fiyat indir al gayet memnu tavsi eder ozellik oyun kamera harika
Olumlu,telefon gayet iyi el oturma kalite kamera gayet güzel biraz ağır fiyat yük on bilerek al zaten herk tavsi eder
Olumlu,iphone verecek para bun ver mantık
Olumsuz,ön kısm ses yer olmadık ses konu kötü fiyat yüz kadar düştük sanıyor aynı zaman ağır telefon kılıf al kap oluyor
Olumlu,dün itibari telefon elim ulaş jelatin samsung türki garanti şekil hissettiren standart i̇lk izlenim kesinlik verdik para fazla hak e bir telefon çentiks sınırs ekran keyif mp ark kamera kalite selfi efsane gb ram test sıkıntıs varlık kanıtlıyor tek sor işare piyasa diğer telefon gör gr ağırlık fazlalık gr olma rahats etmiyor alacak olan şuan hepsibura nın sat olduk bedel kesinlik ideal tof kamera özellik sahip olma değer herk iyi alışveriş not ben hal kargo hızl olabilecek düşünen hel hepsiburada tuzl depo kocae ye intikali gün olma kabul edemiyor
Olumsuz,samsung yapıp ediyor telefon bir yan eksik bırakıyor kamera oldukç iyi inçlik bir ekran batarya tam bir hayal kırıklık telefon kısmen kap ağır bun rağmen batarya yeters gün zar zor çıkartıyor a seri fiyat yük tabi tercih mesele batarya dert etmeyen ideal diyebilir
Olumlu,telefon haftadir kullaniyor malzeme kalite amiral gemi ayar oyun normal kullan performans son derece tatm ediç iyi selfıe çe bir ciha yok piyasa kılıf kullanılma olma gre fiya gel dur tek dezavantaj gr olma ağırlık el iyi oturuyor negatif yor yapacak arkaş önç bir kullan salla yorum itibar etmey
Olumlu,telefon jelatin türki garanti piyasa yüz yirmibes uç ev kadar kapa geliyor teşekkür
Olumsuz,telefon guzel hepsibura sıkıntı kargo sıkıntı telefon alınır bura degil
Olumsuz,tasar çirk telefon kötü alınmaz
Olumlu,telefon değerlendirme önç bir mağaza giderek telefon el alma sonr kurcalamaniz video fotoğraf çekme önerir ben öyl yapt telefon beğen ancak fiyat yük olduk düşme bekl indir girdig al fiyat ilgi değerlendirme teknik düzey bilgi sahip kişi bırakıyor ancak telefon hızl ser harika res video çekebilen harika bir ekran olan şık bir telefon ben aldık renk olan siyah oneriyor
Olumsuz,telefon bir ker takoz diyebilecek ağırlık kal gr ne bir tasar harika diyor yenilikç bir kamera siste tama mi t kolay bi şekil iş çöz özellik or segment fiyat amiral gemi fiyat ülke fazl satış yapabilecek sanmıyor lira civar kadar iner satar fakat o mümk değil tek güzel yan gb ram
Olumsuz,mi t aynı işlemç olarak mi t pro fiyat satılıyor
Olumlu,altinda iyi bir telefon benç alinabilir cam metal den yapilmis diger alt sevi a ser telefon plastik degil full amoled ekran var kamera on kamerasi iyi telefon olabilir fiyat
Olumsuz,samsung a dan a kadar telefon video cekım bozt cekımler asır puslandırıyor
Olumsuz,hızl şarz var yok bun bazilari var diyor bazilari yok diyor
Olumlu,arkadaş ben kullanıyor büyük ekran ekran kamera olmama iyi megapixel ön ark kamera gb ram gb dahi depola iyi yön tam multimedya telefon eksi biraz ağır olma hızl şarj yok önem değil kılıfındayken hızl şarj işlemiyor kulaklık giriş yok arttırılabilir hafız yok zaten yeter yaln ses biraz sor var hoparlör ekra alt ses biraz boğuk geliyor
Olumsuz,fiyat paha donan güçs kali düşük
Olumlu,öncelik fiyat faha demiş saçma böyl mükemmel bir telefon fiyat bil gidip saçm sapan gereks paha ön kamera mp den yük bil olmayan i̇phone lar fiyat kaç katı par veren gel bura samsung u eleştiriyor kamera dönüyor mp mp harika bir özellik gerçek harika telefon üretebiliyor böyl mükemmel bir telefon başka hiçbir marka hiçbir model bulamaz samsung lar sürek olarak yazıl güncelleme geliyor esk telefon model yen çıkan aynı güncel sür kullanıyor i̇phone ler güncelle denen bir yok aksin yen model çıktıkç esk model yavaşlıyor donuyor hâlâ bun rağmen telefon kötü eleştiri bulunuyor dönüp beğendik i̇phone lar bir inceley samsung samsung
Olumsuz,samsung bugün kadar yaptık kötü telefon dese yanlış olmaz cihazi baş son heryer ha bir on rağmen böyl abar bir fiyat
Olumsuz,guzel bir cihaz aslinda sade a gore biraz fazl yuksek ara fark azaliyor dusus olur ali der kamera iyi ark cam gorilla glass yan aluminum kalite performans a e gore bi tik iyi ekran gercek full ekran amoled olmasi buyuk bir arti
Olumsuz,şuan telefon snapdragon kullanmak ön kamera tasarruf var karşılık yükselen mekanizma var ik kamera bir sanır toft kamera fakat mi t bil piyasa k dan girt bun eder benç fazl k
Olumsuz,sade kızak kamera or segment bir telefon par verilmez fiya uygun bir iyi alternatif mevcut alma bir düşü
Olumsuz,hafız kart giriş yok ayrı kulaklık giriş yok kamera kalite amiral gemi seviye değil
Olumsuz,a seri önem özellik ne fiyat performans performans tama fiyat uç telefon a seri dış bir telefon ol insan note seri ya s seri yer telefon alsinlarki saçmalık
Olumsuz,al deney sever biz öner
Olumlu,telefon gereks paha ülke vergi eklen para ikinç el iphone x bil bulur hat ucuz
Olumsuz,samsung trdek kullanıcı alay etme kanı telefon ürün or segment fiyat halin bak
Olumlu,kamera şuan piyasa yok derece güzel kamera özellik ön geçi anlıyor böyl bi kamera yok harika gb ram var bu iyi bir özellik mutlak al der pişman olmaz
Olumlu,bari optik görüntü sabitleyiç olsa
Olumsuz,bun bn verecek k a alır dahz iyi samsung kafa ye son çırpınış sergiliyor
Olumsuz,kesinlik fiyatin haketmiyor fiya iyi seç var
Olumsuz,gereks paha s plus alınabilir iyi
Olumsuz,fiyat gerçek paha unutmamak gerekirk telefon or segment bi cihaz para s s plus huawei p pro amiral gemi cihaz alınabilir tasar güzel olabilir kizakli tasar falan kizağa par verilmez benç
Olumsuz,para donanım telefon alınmaz b telefon alınacak note ya note alınır o olma s plus alınır telefon asl alınmaz asl
Olumsuz,samsung tasar anlam gerçek güzel bir telefon orta ko ancak telefo yurt dış fiyat ülke fiyat ara uçur bulunmak bun sebep s aile satış baltalamamak adın yapıldık düşünüyor malum yük kur vergi dola türki telefon satış düşt
Olumsuz,rakip mi t den satılıyor s la aynı fiya satılıyor s kadar basarı bir donan yok
Olumsuz,kamera diyafra değer or sevi model geri telefo ağırlık uzunluk kalınlık fazl telefon almak isteyen tavsiye a model inceles ay kullan sonra gönül rahatlık önerebilir son olarak yılbaş fiyat k civar inecek illa alacak diyen olur biraz bekles
Olumsuz,yazık iyi bir f p bek biz hayal kırıklık uğrat
Olumsuz,s plus aynı fiya or sevi man iş değil
Olumlu,benç ali gb ram var
Olumsuz,samsung kent ba geliştir çentiks ekran olma ayr bir hav kat fakat özellik öyl ah şah değil fiyat yük şahsi fikr ara bekliyor
Olumsuz,fiya telefon alınmaz ayrı snapdragon ols bil telefo fazl eder tl dir telefon yer s biraz verip s plus alınabilir unutmay or segment bir telefon kadar par etmez
Olumsuz,amiral gemi s telefon aynı fiyat çıkarmak iş bir başar
Olumsuz,donanım gör fiyat paha fakat tasarım laf yok ayrı hafız kart destek yok üstelik telefo kalınlık nere cm
Olumsuz,gb telefon alınmaz
Olumsuz,telefon güzel fiyat gore kamera kulaklık kötü
Olumsuz,bugü el ulaş saatte olt bir sure takı kalacak sürek dont umar bun gecıç problem kullanan arkadaş fikir verir sevinir zira şık bir tlf büyük hafif şık
Olumsuz,kas şekl kanıp al pişman olt cihaz kağn kamera ikon bastık sani sonr kamera açılıyor sinirlenme seviyor düşünme al
Olumsuz,telefon alırken ramin hafıza değil işlemci bak işlemci gerçek düşük ilk alındık kasm bir kaç a kadar kasacak donacak fiya xiaominin iyi telefon var
Olumsuz,kadar hantal bir telefon olamaz kasıyor
Olumsuz,kesinlik almay berbat bir telefon res çekmek poz verdıgınızde dk aynı şekil durur çeks sosyal medya uygulama zaten açılmıyor oyun oynamak yükleme başarabilir heykel dikilir huawei telefon senı zirve yer balıkla çaktıracak haberı ols üretım dur ya piyasa topl para bol olup çöp atar dıyen buyur siz fırsat huawei y al
Olumsuz,almay kasıyor
Olumsuz,arkadas cihaz okadar kasiyorki huawei cihazi ev sokma
Olumsuz,bukadar yavaş bi telefon olamaz eşim al bin pişman donuyor kasıyor gb hafız kart al yin aynı huawei ye yakışmıyor telefon pişman olur almay
Olumsuz,böyl kasm olmaz tlf degil rezalet
Olumsuz,almayi
Olumsuz,ben al tek kel beş par etmez samsung al der
Olumsuz,tek kelime pişmanlık
Olumsuz,olums yorum heps katılıyor fazla var eksik yok telefon al bir haf kullan doğru kullanma çalış bakt sinir duvar çalıp kıracak bir kenar atıp xiaomi red mi plus al huawei model kent imaj zarar ver ben asl başka bir model alma almak isteyen engel olma çalışır
Olumsuz,donuyor gerçek sinir bozuç şekil takıl yapıyor özellik kamera
Olumsuz,gb ram var kasıyor donuyor almay sak
Olumsuz,büyük bir hayal kırıklık kut icerik ner bombos güncelleme sonr gün yetersız hafız uyarı veriyor sureklı cok pışman olt aldık
Olumsuz,cihaz an menü camera tıklıyor sabredip bekliyor kamera açıl ne açılıyor bir sür sonr donukluk rağmen fotoğraf çek tuş basıyor yin sabır ada gülüyor diyel çeker çektik ada muhtemelen çalış hayat dön oluyor cihaz gb ram var zaten düşük emek maaş görüntü güzel foto oyun falan iş olmaz diyor al dice öyl bil ols emek kardes para j prim al hem samsung yetki servis nere bir il var sor olur uğraşmaz ben tel pişman pişman olmay
Olumsuz,cihaz başka bir yer al tl fazl vererek tasar güzel kalite hissettiriyor fakat cihaz aşır derece kasıyor hem öyl böyl değil kamera ekran vasat kadar kasm normal değil belki ben cihaz sor var kıs zaman aldık yer götürüce
Olumsuz,uzak durulma gere bir telefon ekran sürek donuyor
Olumsuz,yüz tan yavaş parmak iz yavaş kullan yavaş telefon görsel güzel yavaşlık takılma telefon kullanamıyor bil ne par verilir bun bile ihtiyar telefon olur ancak alo demek
Olumsuz,urun camerasi ark ön kötü rakip gore gb rem gb hafiza ger kalmis sade bataryani mah olmasi watt sarj adaptöru kutu olmasi iyi ekran full hd yaziyo tft lcd ekran oldug alistig samsung ekranlarindan cok uzak biraz soluk mat amoled ekran gör parmak iz iyi calisiyo ara son olarak ekran dayaniksiz telefon gelt kutu cikardik arkadim yarim metr yuksek yer dusur alt sol kose kiril sanir gorilla glass kor yok varsa adis var sanir ptt kargo tam bi rezillik telefon gün gelt ara pazar gun vardi gene cok gec
Olumsuz,kırmamak diş sıkıyor bazen olma zaman yeter ekran donuyor yaz yazmak zor bun alıp stre gireceg çin mal al iyi
Olumsuz,telefon dün sipariş ett aralık tesl tarih görünüyor süper hızl gönder müşter hizmet aradık sürek sıra sürek ot kiş mi bekliyor hat anla
Olumsuz,sürek ekran donuyor ilk dokunmatik ekran telefon yıl ol adam ekran bak lanet ols böyl telefon
Olumsuz,telefo fiyat uygun olabilir batarya kuvvetlı olabilir fakat telefo kılıf giren pislik toz vesair ark kapak iz yapıyor düş kalites kapak var dokunmatik ekran kalite iş yaramaz ay sonr donma başlıyor uygula kıs süre telefon yavaşla batarya problem başlıyor ben telefon düşür cep herhangi bir ezil durumu olma ay kullan sonr ekran kent kent şey tıklıyor yaz yazarken harf falan algiliyor ben kadar hassas kullansa telefon yormasa telefon anlattık şekil olt samim yazıyor arkadaş ben tavsi etmiyor telefo fiyat kadar uygun sanıyor redm not al bun iyi alma önç yazdık düşü öyl al ben pişman
Olumsuz,fiyat performans telefon çıkmış performans göre kamera iyi degil büyük dinma mevcut tuş bası kalıyor
Olumsuz,mart ayinda aldim an tari̇hler eki̇m ayin gösteri̇yor yor yaklaşik aylik bi̇r süreç edi̇ndi̇ği̇m deneyi̇m yor telefon güzel uzun vadeli̇ olamayacak i̇ş i̇çi̇n akti̇f sürekli̇ kullanilamayacak telefon ay sonr kamera açarken donm başladi uygulama takilma başladi gb hafiza kartinda bi̇lgi̇ler saklanmasina ragmen opti̇k kamera sabi̇tleyi̇ci̇ hak geti̇re gün ugraşmazsaniz sarji gi̇di̇yor ay geçi̇nce tekrar gün düşt malzeme kali̇tesi̇ kötü kilifs kullanamaz
Olumsuz,mağaza teşekürl
Olumsuz,bildir ışık yok
Olumsuz,ürün kamera tasar güzel fakat sürek şebek sor veriyor kasm donm yapıyor para değmez
Olumsuz,telefo cek guç cok zayif istanbul un göbeg bil cekmedig gorusme ani kesiliyor karsi taraf kasten kapattig dusunuyor benç yazilimsal bir sor var tavsi etmiyor
Olumsuz,şebek sor var esk telefon çektik yer wi fi ağın bağlanamiyor tam bir fiyasko cihaz faturasi gelm kaç görüş h b bi sonuç alam tafsi etmiyor
Olumsuz,şarz gün ancak gıdıyor şebek sor fazla var kamera vasat
Olumsuz,kamera vasat aynı para muadil iş görür
Olumsuz,ürün satıç süper telefon android gelt çek git net ara anç sokakt
Olumsuz,son guncelleme sonr mesaj bil yazmak zor internet cekmiyor sebek sor aydir kullaniyom çöp olt tek iyi sarji uzun gidiyo
Olumsuz,alal ay olt herşe süper laf yok wi fi şebek internet çekmiyor sosyal medya uygulama diğer internet sayfa sürek takılıyor klavye yaz yazarken sn civar takı kalıp sonr kendilik ger geliyor internet önem olduk bi devir telefo internet sor olma pişmanlık
Olumsuz,telefon al güncelleme yap şebek git şimt servis gönder bekliyor
Olumsuz,oyun düşk değil iyi sarj gün gidiyor gün düşt normal kullan siz sen boyu asil telefonluk görev yer getirebilecek söyleyebilir sonra donm kamera bozukluk odakla sorun başlayacak tek sor sık sık nem algılan diyor açıp kapat geçiyor son zaman geç pirinç koyduk kap iç getiriyor şarj soket yer sor kalm
Olumsuz,dokunmatik ekran ar sira donuyor acm kapa yapinca duzeliyor dar uzun ekran batarya normal killanimda gun gidiyor oyun video izler gun gidiyor eski nokia şimdi samsung mo
Olumsuz,sensör iyideğil ben telefon görüşüyor telefon kulak bakıyom bekleme gir bekleme çıkartıyor bakıyom yin bekleme al şahsen ben samsung soğu butelefon sonr
Olumsuz,gerçek kötü olan bir var kamera özellik ön kamera geç çek yapmak mümk değil on kamera mp diyor geç çekim ışık olan orta ilk üretilen kamera telefon res çekiyor sırf yüz iade etm şans ols iade eder evet büyük şey beklemiyor kadar kötü beklemiyor
Olumsuz,saat olt google olay uygula indiremiyor
Olumsuz,ben xiamoi red mi note m ara kalt sonuç olarak redm note tercih ett siz tavsiye red mi nö al android geliyor
Olumsuz,son güncelleme sonr telefon çöp olt klavye takıl donm mobil ver kesinti ekran takıl yen güncelle gelip düzeltilen kadar kesinlik almay der sonr pişman olur şikayet bakar konu bir sür şikayet görecek yazarken silm tuş takı kalt baş yazmak zor kalt
Olumsuz,iyi hoş güzel telefon son güncelleme aldık snra telefon ısınma tut donma kadar bir sor var büyük sor klavye taki kaliyor
Olumsuz,telerfon güzel yen gelen guncelleme çöp olt telefon kasm yaşiyor akicilik git telefon
Olumsuz,telefon mah batarya sahip ben j prim var mah asagi yukari performans ayni sanir bataryayi ben gun gider sanmis
Olumsuz,kasa dola puan veriyor haf olt kılıf kullanma ragmen çizil yaşa biyere düşür diğer özellik güzel kasa kırılgan
Olumsuz,dandik telefon max var ben gün fazl gidiyo gün gitmiyor batarya denilen kadr değil benç diğer özellik kötü
Olumsuz,mart ayın indir al aylık kullan sonuç pozitif yor yapamayacak kamera performa eh iş mutl etmiyor batarya de öyl yazdık bakmay can sıkıç nokta yazıl hata i̇nstagram bir uygula tam ekran sor yaşıyor uygula ekran sığmıyor bun samsung destek ileş kursa çöz yok ay geç hal düzelmeyen bir sor i̇çler acıs uygula iç kon güncelleyemiyor vs dokunmatik saçm sapan bir şekil çalışıyor bazen donm sorun yaşa bir kaç kalt oyun oynamıyor zaten açmıyor basitç marka satma çalışıyor iş böyl yürümez önce samsung kullan j seri a ser note seri telefon ben samsung soğut başarıs anki fiyatıyla kimse önerme alırken zaten kamera oyun performans beklemiyor yazıl hata batarya istenilen performa vermeme ayrı samsung destek yardım konu eks olma dola memnu değil
Olumsuz,ürün yaklaşık gün kullanıyor geldik gün ber bir türl iç sinm şarj gün gidiyor gün zor tamamlıyor asl mah batarya performans değil pil tüket fazl olduk sanıyor ısın oluyor tasarım geli ağır kap gelt ban bildir sensör hiçbir yok ekran dokunmatıği basm sanır aldık pişman
